[
  {
    "id": "milk-pasteurized",
    "name": "Молоко пастеризованное",
    "category": "Молочная продукция",
    "synonyms": [
      "молоко",
      "свежее молоко",
      "молоко в пакете"
    ],
    "shelf_life_days": {
      "fridge": 7,
      "freezer": 30,
      "pantry": null
    },
    "after_opening_hours": 48,
    "risk_level": "high",
    "sanpin_ref": "СанПиН 2.3.2.1324-03 п. 3.2",
    "storage_tips": "Средняя полка. Не хранить на дверце из-за перепадов температур.",
    "default_unit": "l",
    "notify_before_days": 2
  },
  {
    "id": "milk-uht",
    "name": "Молоко ультрапастеризованное",
    "category": "Молочная продукция",
    "synonyms": [
      "ультрапастеризованное молоко",
      "тетрапак молоко",
      "длительное молоко"
    ],
    "shelf_life_days": {
      "fridge": 120,
      "freezer": 30,
      "pantry": 90
    },
    "after_opening_hours": 72,
    "risk_level": "medium",
    "sanpin_ref": "СанПиН 2.3.2.1324-03",
    "storage_tips": "В закрытом виде хранить в шкафу. После откупоривания — строго в холод.",
    "default_unit": "l",
    "notify_before_days": 3
  },
  {
    "id": "kefir",
    "name": "Кефир",
    "category": "Молочная продукция",
    "synonyms": [
      "кефир",
      "кисломолочный напиток"
    ],
    "shelf_life_days": {
      "fridge": 7,
      "freezer": null,
      "pantry": null
    },
    "after_opening_hours": 48,
    "risk_level": "high",
    "sanpin_ref": "СанПиН 2.3.2.1324-03",
    "storage_tips": "Брожение продолжается при хранении. Заморозка разрушает структуру.",
    "default_unit": "l",
    "notify_before_days": 2
  },
  {
    "id": "sour-cream",
    "name": "Сметана 15-20%",
    "category": "Молочная продукция",
    "synonyms": [
      "сметана",
      "сметаночка"
    ],
    "shelf_life_days": {
      "fridge": 10,
      "freezer": null,
      "pantry": null
    },
    "after_opening_hours": 72,
    "risk_level": "high",
    "sanpin_ref": "СанПиН 2.3.2.1324-03",
    "storage_tips": "Забирать только чистой сухой ложкой. При заморозке расслаивается.",
    "default_unit": "pack",
    "notify_before_days": 2
  },
  {
    "id": "cottage-cheese",
    "name": "Творог 5-9%",
    "category": "Молочная продукция",
    "synonyms": [
      "творог",
      "творожок"
    ],
    "shelf_life_days": {
      "fridge": 4,
      "freezer": 60,
      "pantry": null
    },
    "after_opening_hours": 36,
    "risk_level": "high",
    "sanpin_ref": "СанПиН 2.3.2.1324-03",
    "storage_tips": "Быстро впитывает запахи чеснока и копченостей. Хранить герметично.",
    "default_unit": "g",
    "notify_before_days": 1
  },
  {
    "id": "butter",
    "name": "Масло сливочное 82.5%",
    "category": "Молочная продукция",
    "synonyms": [
      "масло сливочное",
      "маслице"
    ],
    "shelf_life_days": {
      "fridge": 30,
      "freezer": 270,
      "pantry": null
    },
    "after_opening_hours": 360,
    "risk_level": "medium",
    "sanpin_ref": "СанПиН 2.3.2.1324-03",
    "storage_tips": "В масленке из непрозрачного материала. Молочный жир окисляется на свету.",
    "default_unit": "g",
    "notify_before_days": 3
  },
  {
    "id": "cream-pasteurized",
    "name": "Сливки 10-20%",
    "category": "Молочная продукция",
    "synonyms": [
      "сливки",
      "сливочки"
    ],
    "shelf_life_days": {
      "fridge": 5,
      "freezer": 30,
      "pantry": null
    },
    "after_opening_hours": 48,
    "risk_level": "high",
    "sanpin_ref": "СанПиН 2.3.2.1324-03",
    "storage_tips": "Хранить на внутренней полке при +2..+4 °C. Не оставлять открытыми.",
    "default_unit": "l",
    "notify_before_days": 1
  },
  {
    "id": "yogurt-natural",
    "name": "Йогурт натуральный",
    "category": "Молочная продукция",
    "synonyms": [
      "йогурт",
      "йогурт питьевой",
      "греческий йогурт"
    ],
    "shelf_life_days": {
      "fridge": 14,
      "freezer": 30,
      "pantry": null
    },
    "after_opening_hours": 48,
    "risk_level": "medium",
    "sanpin_ref": "СанПиН 2.3.2.1324-03",
    "storage_tips": "После вскрытия фольги употребить в течение двух суток.",
    "default_unit": "pack",
    "notify_before_days": 2
  },
  {
    "id": "condensed-milk",
    "name": "Сгущенное молоко",
    "category": "Молочная продукция",
    "synonyms": [
      "сгущенка",
      "сгущенное молоко с сахаром"
    ],
    "shelf_life_days": {
      "fridge": 365,
      "freezer": null,
      "pantry": 365
    },
    "after_opening_hours": 168,
    "risk_level": "low",
    "sanpin_ref": "ГОСТ 31688-2012",
    "storage_tips": "После вскрытия жестяной банки переложить в стеклянную тару.",
    "default_unit": "pack",
    "notify_before_days": 7
  },
  {
    "id": "ryazhenka",
    "name": "Ряженка",
    "category": "Молочная продукция",
    "synonyms": [
      "ряженка",
      "варенец"
    ],
    "shelf_life_days": {
      "fridge": 7,
      "freezer": null,
      "pantry": null
    },
    "after_opening_hours": 48,
    "risk_level": "high",
    "sanpin_ref": "СанПиН 2.3.2.1324-03",
    "storage_tips": "Хранить строго в холодильнике.",
    "default_unit": "l",
    "notify_before_days": 2
  },
  {
    "id": "curd-snack",
    "name": "Сырок глазированный",
    "category": "Молочная продукция",
    "synonyms": [
      "сырок",
      "творожный сырок"
    ],
    "shelf_life_days": {
      "fridge": 14,
      "freezer": 120,
      "pantry": null
    },
    "after_opening_hours": 12,
    "risk_level": "medium",
    "sanpin_ref": "СанПиН 2.3.2.1324-03",
    "storage_tips": "Хранить в холодильнике или морозильнике.",
    "default_unit": "pcs",
    "notify_before_days": 2
  },
  {
    "id": "parmesan",
    "name": "Сыр Пармезан",
    "category": "Сыры",
    "synonyms": [
      "пармезан",
      "грана падано",
      "твердый сыр"
    ],
    "shelf_life_days": {
      "fridge": 60,
      "freezer": 180,
      "pantry": 2
    },
    "after_opening_hours": 720,
    "risk_level": "low",
    "sanpin_ref": "USDA FoodKeeper",
    "storage_tips": "Заворачивать в пергамент. При появлении плесени срезать слой на 2 см.",
    "default_unit": "g",
    "notify_before_days": 7
  },
  {
    "id": "gouda",
    "name": "Сыр Гауда / Российский",
    "category": "Сыры",
    "synonyms": [
      "гауда",
      "российский сыр",
      "тильзитер",
      "полутвердый сыр"
    ],
    "shelf_life_days": {
      "fridge": 21,
      "freezer": 90,
      "pantry": null
    },
    "after_opening_hours": 240,
    "risk_level": "medium",
    "sanpin_ref": "СанПиН 2.3.2.1324-03",
    "storage_tips": "Сырница с мембраной регулировки влажности. Исключить полиэтилен.",
    "default_unit": "g",
    "notify_before_days": 3
  },
  {
    "id": "camembert",
    "name": "Сыр Камамбер / Бри",
    "category": "Сыры",
    "synonyms": [
      "камамбер",
      "бри",
      "сыр с белой плесенью"
    ],
    "shelf_life_days": {
      "fridge": 10,
      "freezer": null,
      "pantry": null
    },
    "after_opening_hours": 72,
    "risk_level": "high",
    "sanpin_ref": "USDA FoodKeeper",
    "storage_tips": "Заводская дышащая микроперфорированная бумага. Заморозка разрушает текстуру.",
    "default_unit": "g",
    "notify_before_days": 2
  },
  {
    "id": "mozzarella-brine",
    "name": "Сыр Моцарелла в рассоле",
    "category": "Сыры",
    "synonyms": [
      "моцарелла",
      "моцарелла в рассоле"
    ],
    "shelf_life_days": {
      "fridge": 5,
      "freezer": null,
      "pantry": null
    },
    "after_opening_hours": 48,
    "risk_level": "high",
    "sanpin_ref": "СанПиН 2.3.2.1324-03",
    "storage_tips": "Хранить исключительно в рассоле. На воздухе высыхает за 12 часов.",
    "default_unit": "pack",
    "notify_before_days": 1
  },
  {
    "id": "mascarpone",
    "name": "Сыр Маскарпоне / Рикотта",
    "category": "Сыры",
    "synonyms": [
      "маскарпоне",
      "рикотта",
      "крем-чиз",
      "свежий сыр"
    ],
    "shelf_life_days": {
      "fridge": 10,
      "freezer": null,
      "pantry": null
    },
    "after_opening_hours": 72,
    "risk_level": "high",
    "sanpin_ref": "СанПиН 2.3.2.1324-03",
    "storage_tips": "Высокая активность воды. Уязвимы к плесени. Не замораживать.",
    "default_unit": "g",
    "notify_before_days": 2
  },
  {
    "id": "processed-cheese",
    "name": "Сыр плавленый",
    "category": "Сыры",
    "synonyms": [
      "плавленый сыр",
      "сыр в ванночке",
      "дружба"
    ],
    "shelf_life_days": {
      "fridge": 30,
      "freezer": null,
      "pantry": null
    },
    "after_opening_hours": 120,
    "risk_level": "low",
    "sanpin_ref": "СанПиН 2.3.2.1324-03",
    "storage_tips": "Соли-плавители повышают стабильность. Хранить под плотной крышкой.",
    "default_unit": "pack",
    "notify_before_days": 3
  },
  {
    "id": "brynza",
    "name": "Сыр Брынза / Фета",
    "category": "Сыры",
    "synonyms": [
      "брынза",
      "фета",
      "рассольный сыр"
    ],
    "shelf_life_days": {
      "fridge": 15,
      "freezer": null,
      "pantry": null
    },
    "after_opening_hours": 72,
    "risk_level": "medium",
    "sanpin_ref": "СанПиН 2.3.2.1324-03",
    "storage_tips": "Хранить в собственном рассоле в стеклянной или эмалированной таре.",
    "default_unit": "g",
    "notify_before_days": 2
  },
  {
    "id": "cheddar",
    "name": "Сыр Чеддер",
    "category": "Сыры",
    "synonyms": [
      "чеддер",
      "сыр чеддер"
    ],
    "shelf_life_days": {
      "fridge": 30,
      "freezer": 180,
      "pantry": null
    },
    "after_opening_hours": 336,
    "risk_level": "low",
    "sanpin_ref": "USDA FoodKeeper",
    "storage_tips": "Оборачивать вощенной бумагой или пергаментом.",
    "default_unit": "g",
    "notify_before_days": 4
  },
  {
    "id": "dor-blue",
    "name": "Сыр Дор Блю / Рокфор",
    "category": "Сыры",
    "synonyms": [
      "дор блю",
      "рокфор",
      "сыр с голубой плесенью"
    ],
    "shelf_life_days": {
      "fridge": 14,
      "freezer": null,
      "pantry": null
    },
    "after_opening_hours": 96,
    "risk_level": "medium",